/rooms/5628541	https://a0.muscache.com/im/pictures/71239673/0af133a3_original.jpg?aki_polity=xx_large	Stunning Unique Church Conversion - Castles for Rent in Glasgow, United Kingdom	Jul 29, 2018 - Entire home/apt for $157. A one of kind conversion in the south side of Glasgow consisting of Living room / dining room  , 2 Bedrooms with Jack and Jill en-suite and separat...
/rooms/8098262	https://a0.muscache.com/im/pictures/18f1191b-c1ba-496a-867c-4db257bdd903.jpg?aki_polity=xx_large	The Fox House: light-filled home in the trees - Treehouses for Rent in Nashville, Tennessee, United States	Jul 29, 2018 - Entire home/apt for $110. Hosts of the Fox House. A beautiful light-filled guest house, surrounded by windows with a private bath, entrance and deck. Home is on a two acre w...
/rooms/4277345	https://a0.muscache.com/im/pictures/3863a22e-533d-4b4c-80bd-1f242c525629.jpg?aki_polity=xx_large	Tree House at the Shire - Treehouses for Rent in Conway, New Hampshire, United States	Jul 29, 2018 - Entire home/apt for $95. This quaint little cabin in the trees was designed for a true get away.  If the desire is to unplug, this retreat is for you.  Rural yet 15-20 minu...
/rooms/955115	https://a0.muscache.com/im/pictures/d3da95d0-829d-4e34-9400-efb55dd32dc2.jpg?aki_polity=xx_large	The Muse Haus I - Black Sheep - Houses for Rent in London, United Kingdom	Jul 29, 2018 - Private room for $84. *Self-check-in: 24/7 - virtual host *Private feel & ensuite bathroom, door locks *High-speed Wifi *Free (basic) breakfast (Nespresso!) *Daily clea...
/rooms/11130000	https://a0.muscache.com/im/pictures/70c9682b-8719-4f39-9f77-b06270ae2e03.jpg?aki_polity=xx_large	Antique MachiyaHouse JR kyoto Toji - Townhouses for Rent in Minami Ward, Kyoto, Kyoto Prefecture, Japan	Jul 29, 2018 - Entire home/apt for $144. ★There is an antique shop in the guest house. ★ It is a traditional building of Kyoto ★From Kyoto station, 15 minutes on foot ★From Kintetsu Touji ...
/rooms/15342315	https://a0.muscache.com/im/pictures/d58a05e2-6baa-4c68-a296-0eec8da757c3.jpg?aki_polity=xx_large	Charming Cabin Near Deep Ellum & Fair Park - Tiny houses for Rent in Dallas, Texas, United States	Jul 29, 2018 - Entire home/apt for $60. My cabin is a hidden gem in Urbandale, a neighborhood only 15 minutes from downtown that's filled with unique architecture, old trees, and multicul...
/rooms/788235	https://a0.muscache.com/im/pictures/23382828/bee5835d_original.jpg?aki_polity=xx_large	Tree House 10 mins drive fr center  - Treehouses for Rent in Mueang Chiang Mai, Chiang Mai, Thailand	Jul 29, 2018 - Private room for $35.  Viva Chiang Mai  nature home stay is the latest accommodation adding alternative for travelers searching for perfect place to stay during their vi...
/rooms/3068586	https://a0.muscache.com/im/pictures/39408019/48808569_original.jpg?aki_polity=xx_large	Casa do Rio - Beach and Mountains - Cottages for Rent in Viana do Castelo, Viana do Castelo District, Portugal	Jul 29, 2018 - Entire home/apt for $87. If you like nature then this is the right place. An old stone house refurbished with modern yet cosy style. Close to Serra d’Arga (mountain) and An...
/rooms/10570359	https://a0.muscache.com/im/pictures/d6dd0136-c192-43e7-8b4b-8bf51fb4b6f2.jpg?aki_polity=xx_large	The Tilman House - Apartments for Rent in Washington, District of Columbia, United States	Jul 29, 2018 - Entire home/apt for $100. Our historic one bedroom apartment is carved out of an 1895 Victorian row house.  It has nice character and charm. Located in a fantastic neighborh...
/rooms/2403570	https://a0.muscache.com/im/pictures/42766432/6666819e_original.jpg?aki_polity=xx_large	An Adirondack Tree House Retreat - Treehouses for Rent in Middle Grove, New York, United States	Jul 29, 2018 - Entire home/apt for $260. Our Treehouse Retreat is one of the most sought after destinations for couples seeking to reconnect with nature. Nestled in the foothills of the Ad...
/rooms/499872	https://a0.muscache.com/im/pictures/7084336/0e650768_original.jpg?aki_polity=xx_large	Luxury Apartment VOLAT, Downtown - Caves for Rent in Split, Split-Dalmatia, Croatia	Jul 29, 2018 - Entire home/apt for $47. The apartment is a newly converted, 200 years old wine cellar. It is situated on the ground floor of a typical Croatian stone house which dates bac...
/rooms/798483	https://a0.muscache.com/im/pictures/52149945/33130c63_original.jpg?aki_polity=xx_large	Stunning All Bamboo House on Pristine Valley edge - Houses for Rent in Abiansemal, Bali, Indonesia	Jul 29, 2018 - Entire home/apt for $325. Selected as one of Airbnb's top picks, Sunrise house has been delighting its guests and celebrities from all over. In such a tranquil setting,  oft...
/rooms/5694880	https://a0.muscache.com/im/pictures/90650537/58ce389d_original.jpg?aki_polity=xx_large	Magical B & B by the Sea Havana - Casa particulars (Cuba) for Rent in La Habana, La Habana, Cuba	Jul 29, 2018 - Private room for $82. Cuban house in Havana that offers its guests a very special environment where taste and tradition come together in a magic look all white Located...
/rooms/5867274	https://a0.muscache.com/im/pictures/98504067/d24f22b5_original.jpg?aki_polity=xx_large	Superbe studio Centre ville  40 m2 - Apartments for Rent in Jardin Public - Chartrons, Bordeaux, Aquitaine, France	Jul 29, 2018 - Entire home/apt for $64.  A beautiful address for this elegant and refined studio, quiet street on an intimate entrance of the Public Garden.   Cozy:   -a bed convertible i...
/rooms/577410	https://a0.muscache.com/im/pictures/7151074/aecc9790_original.jpg?aki_polity=xx_large	Super Cute Retro Airstream - Campers/RVs for Rent in Wimberley, Texas, United States	Jul 29, 2018 - Entire home/apt for $130. Book a couple of nights with us and experience glamping in the Texas hill country! With a hot tub, fire pit, outdoor shower, basic kitchen, queen b...
/rooms/2437969	https://a0.muscache.com/im/pictures/42492006/d656f7da_original.jpg?aki_polity=xx_large	Cozy A-Frame Cabin in the Redwoods - Houses for Rent in Cazadero, California, United States	Jul 29, 2018 - Entire home/apt for $175. Enjoy peace, quiet, and beautiful views in Cazadero.   For each rental, $50 will be donated to Raphael House, a San Francisco organization whose go...
/rooms/39492	https://a0.muscache.com/im/pictures/45655208/1ae646f5_original.jpg?aki_polity=xx_large	Joshua Tree Homesteader Cabin - Cabins for Rent in Joshua Tree, California, United States	Jul 29, 2018 - Entire home/apt for $114. *This cabin was featured in the New York Times in January, 2017. * A magical homesteader cabin embedded in 5 acres of unfenced Joshua Tree desert w...
/rooms/2735958	https://a0.muscache.com/im/pictures/37689021/6d771134_original.jpg?aki_polity=xx_large	Sleep on a boat in Stamford! Relaxation on the Sea - Boats for Rent in Stamford, Connecticut, United States	Jul 29, 2018 - Entire home/apt for $85. Step out of the ordinary, and stay our lovely sailboat in Stamford Harbor!  Our 1966 Pearson is a charming old yacht, with a wood burning fireplace...
/rooms/18002228	https://a0.muscache.com/im/pictures/0fd06b60-efa1-48f2-aadd-f92c15d7aaae.jpg?aki_polity=xx_large	Rococo Romance: 2 Bedroom Cap Hill - Apartments for Rent in Denver, Colorado, United States	Jul 29, 2018 - Entire home/apt for $145. A romantic two bedroom oasis in the center of Capitol Hill awaits your entrance. This recently renovated Mansion surprises and delights in its deli...
/rooms/4979069	https://a0.muscache.com/im/pictures/3b31ee97-00ad-4a65-a45b-9be30fca8ade.jpg?aki_polity=xx_large	Tami Private Cove - Huts for Rent in Siargao Island, Surigao del Norte, Philippines	Jul 29, 2018 - Entire home/apt for $99. A cluster of tropical cottages in a seashore park along a private fine white sand beach in Bucas Grande, the first island of access to Siargao. Unl...
/rooms/10436077	https://a0.muscache.com/im/pictures/a85d04ad-adac-4ed2-951b-b40730d8ea9e.jpg?aki_polity=xx_large	Licensed luxurious guesthouse with Parking Garage - Houses for Rent in Santa Monica, California, United States	Jul 29, 2018 - Entire home/apt for $160. Stylish detached guesthouse in the quiet Santa Monica neighborhood loaded with everything including 42in TV equipped with HBO NOW, private garage a...
/rooms/526402	https://a0.muscache.com/im/pictures/5deabe13-c7af-4680-b5fe-1fb54d0acc31.jpg?aki_polity=xx_large	Windmill by the sea in Tinos // Stavros Bay - Windmills for Rent in Tinos, South Aegean, Greece	Jul 29, 2018 - Entire home/apt for $152. Unique windmill house with breathtaking sea view. Located in a magic and convenient spot, next to Stavros Beach (1min walk) and walking distance to...
/rooms/5007326	https://a0.muscache.com/im/pictures/63671050/62e1c940_original.jpg?aki_polity=xx_large	Ocean Beachfront Luxury Design Villa @ Lovina - Villas for Rent in Dencarik, Bali, Indonesia	Jul 29, 2018 - Entire home/apt for $197. The white modern design beachfront villa is surrounded by a 700m2 tropical garden. The villa has direct access to the beach and overlooking the Bal...
/rooms/1016153	https://a0.muscache.com/im/pictures/7cc3c855-f90e-4d0f-9b13-3b5c2a3c4bad.jpg?aki_polity=xx_large	BALIAN TREEHOUSE w beautiful pool - Huts for Rent in Balian Beach, Bali, Selemadeg Barat, Indonesia	Jul 29, 2018 - Entire home/apt for $82. The Balian treehouse is only a 3 minute walk away from the beach. From the veranda you can watch the sunrise in the morning, and enjoy the view of ...
/rooms/1720832	https://a0.muscache.com/im/pictures/26003118/06bf6fed_original.jpg?aki_polity=xx_large	Unique Cob Cottage - Earth houses for Rent in Mayne Island, British Columbia, Canada	Jul 29, 2018 - Entire home/apt for $123. Appearing in numerous books on natural building, our cottage is a welcoming and cozy retreat hand sculpted of local, sustainable natural materials ...
/rooms/15519253	https://a0.muscache.com/im/pictures/767d0818-7aa3-496a-836c-ddcc4286bf07.jpg?aki_polity=xx_large	LOFT - luminous and artsy - Lofts for Rent in Montréal, Québec, Canada	Jul 29, 2018 - Entire home/apt for $96. You'll have a true Montreal experience in our studio apartment. Built in 1870, this charming loft is a MTL original, located in the historic Duluth...
/rooms/6644226	https://a0.muscache.com/im/pictures/100298057/ccd8c843_original.jpg?aki_polity=xx_large	Romantic, Cozy Cottage Next to Downtown - Guesthouses for Rent in Nashville, Tennessee, United States	Jul 29, 2018 - Entire home/apt for $167. Comfy, cozy and romantic cottage less than 3 miles from Downtown. The Cleveland Cottage provides a private oasis within city limits that includes f...
/rooms/717914	https://a0.muscache.com/im/pictures/11251132/0496a64c_original.jpg?aki_polity=xx_large	Bright & Cozy Tiny House by the Bay - Tiny houses for Rent in Olympia, Washington, United States	Jul 29, 2018 - Entire home/apt for $89. *Next available nights are July 22 and 23, and August 8 through 14!* Enjoy a coastal getaway while trying out tiny living.  The Bayside Bungalow ti...
/rooms/3389298	https://a0.muscache.com/im/pictures/47939708/e55cd32e_original.jpg?aki_polity=xx_large	La Salentina, sea, nature & relax - Houses for Rent in Tricase, Apulia, Italy	Jul 29, 2018 - Entire home/apt for $80. In the far south of the Salento peninsula, along the coastal road Otranto-Santa Maria di Leuca, the town is located, Guardiola, a real balcony on...
/rooms/792724	https://a0.muscache.com/im/pictures/0c068759-4287-4705-b1fb-83313cfe35b9.jpg?aki_polity=xx_large	Magical Treehouse *TOTALLY UNIQUE* Live the dream! - Treehouses for Rent in Ubud, Bali, Indonesia	Jul 29, 2018 - Entire home/apt for $175. We're thrilled to be one of the most popular (and unique) AIRBNB properties in Bali! Huge trees growing through the rooms, stunning private pool, w...
/rooms/12939918	https://a0.muscache.com/im/pictures/efcfaee6-1a98-451b-aa62-24be58df0a4d.jpg?aki_polity=xx_large	Studio Daisy: Villa with sun deck 5 min to centre - Apartments for Rent in Split, Splitsko-dalmatinska županija, Croatia	Jul 29, 2018 - Entire home/apt for $34. Studio Daisy is in the heart of Varoš and located on the stairs of Marjanske  Skale that take you to the beautiful Marjan hill. The old stone villa...
/rooms/9022570	https://a0.muscache.com/im/pictures/4767809d-a091-4b6b-ae2c-17b92b0591d1.jpg?aki_polity=xx_large	White Pearl in the center of Oberoi - Villas for Rent in Kuta, Bali, Indonesia	Jul 29, 2018 - Entire home/apt for $175. This luxury and elegant 2-bedroom villa with a spacious outside living area is located in the heart of Seminyak in Oberoi street.  This stunning BR...
/rooms/12240375	https://a0.muscache.com/im/pictures/5f5b9755-a699-4c66-a677-487d67b35b99.jpg?aki_polity=xx_large	The Mangersta Pod - Huts for Rent in Isle of Lewis, United Kingdom	Jul 29, 2018 - Entire home/apt for $98. You will find the Pod to be a clean and comfortable haven.  Situated in the village of Mangersta on the Atlantic coast of Lewis, the pod is a few m...
/rooms/1322426	https://a0.muscache.com/im/pictures/51824991/43dce8a6_original.jpg?aki_polity=xx_large	Cabane n°1 dans les arbres du parc d'un château - Treehouses for Rent in Fondettes, Centre, France	Jul 29, 2018 - Private room for $117.  An unusual experience, for an exceptional occasion. A round bed 2.4 m in diameter, where you can sleep for two, or family to 3 or 4 if the childre...
/rooms/1866105	https://a0.muscache.com/im/pictures/54423442/fd506ced_original.jpg?aki_polity=xx_large	Pleasant Bay Lookout (epic sea view + hot tub) - Treehouses for Rent in Bellingham, Washington, United States	Jul 29, 2018 - Private room for $75. The Pleasant Bay Lookout is a private room with a spectacular view, nestled in the trees. Guests access our family's home (where we live full time)...
/rooms/3945272	https://a0.muscache.com/im/pictures/5525f97e-1305-41fb-8e24-512a1551d9f4.jpg?aki_polity=xx_large	Unik Hobbit Cabin - Earth houses for Rent in Hol, Buskerud, Norway	Jul 29, 2018 - Entire home/apt for $170. Cozy and special cabin .  Made unik for a memorable experience   Skiing,hiking,fishing and outside the door.  Free firewood and candlelights.   The...
/rooms/1492432	https://a0.muscache.com/im/pictures/22763150/545bc426_original.jpg?aki_polity=xx_large	Fabrica House downtown cozy WIFI - Apartments for Rent in Porto, Porto, Portugal	Jul 29, 2018 - Entire home/apt for $45. Located in the heart of the city in an acclaimed World Heritage Area is this bright and nicely decorated  with Wi-Fi. The main avenue of Porto, Ave...
/rooms/1310347	https://a0.muscache.com/im/pictures/21100770/dbbfe067_original.jpg?aki_polity=xx_large	LaoJia 老家, a Qing Dynasty House (1) - Castles for Rent in Guilin Shi, Guangxi Zhuangzuzizhiqu, China	Jul 29, 2018 - Private room for $49. This LaoJia 老家 is a revived Qing Dynasty house in a small fishing- farming village. It sits beside the Li River, amongst the mystical karst mountai...
/rooms/11840313	https://a0.muscache.com/im/pictures/bca5cb35-f2ce-4e41-8826-f0f036cdb40a.jpg?aki_polity=xx_large	The Cedar House Rules - Tiny houses for Rent in Charleston, South Carolina, United States	Jul 29, 2018 - Entire home/apt for $135. Welcome to the strange nexus of the universe where you can live tiny and large at the same time!  We can't wait to host you.    Please read our pro...
/rooms/1415908	https://a0.muscache.com/im/pictures/21611933/43f6de69_original.jpg?aki_polity=xx_large	Secluded Intown Treehouse - Treehouses for Rent in Atlanta, Georgia, United States	Jul 29, 2018 - Entire home/apt for $375. AIRBNB'S #1 MOST WISHED-FOR LISTING WORLDWIDE!   *Remaining 2018 dates are available exclusively for folks that have the treehouse on their WISH ...
/rooms/3015395	https://a0.muscache.com/im/pictures/566c689f-19c4-4e12-b6c0-b5f110543fa1.jpg?aki_polity=xx_large	Ella Resort 98 Acres - Nature lodges for Rent in Ella, Uva Province, Sri Lanka	Jul 29, 2018 - Private room for $200. The uniquely placed site in full view of ‘Little Adam’s Peak’, and the salubrious climate of Ella all worked in favor of the resort project going i...
/rooms/7214350	https://a0.muscache.com/im/pictures/15ce9352-5de2-408b-aab5-bd5decc11303.jpg?aki_polity=xx_large	ManCave apartment/ airplane hangar. - Barns for Rent in Geneva, Florida, United States	Jul 29, 2018 - Entire home/apt for $55. This is my man cave located in my airplane hanger. An eclectic collection of stuff is hung from the ceiling and walls. This is a fun space with a b...
/rooms/20927	https://a0.muscache.com/im/pictures/6a637b4f-54d4-4806-b64d-9d180f4a54ad.jpg?aki_polity=xx_large	Cottage in the Heart of Ballard - Guesthouses for Rent in Seattle, Washington, United States	Jul 29, 2018 - Entire home/apt for $89. A  cozy cottage behind a lovely Victorian house. It has a 3/4 bath (shower). The cottage has a brick patio and a large trellis covered with roses a...
/rooms/5085861	https://a0.muscache.com/im/pictures/63873623/3fd77c2a_original.jpg?aki_polity=xx_large	Romantic, Erotic, And totally Exotic! - Villas for Rent in Canggu, Bali, Indonesia	Jul 29, 2018 - Entire home/apt for $110. *Please note accommodation rates shown are subject to 10% staff service charge and 11% Indonesian hotel tax, chargeable upon check out as required ...
/rooms/3406062	https://a0.muscache.com/im/pictures/307a5575-c3a4-4b21-8127-a37875ec1239.jpg?aki_polity=xx_large	Malibu Dream Airstream - Campers/RVs for Rent in Malibu, California, United States	Jul 29, 2018 - Entire home/apt for $600. Escape civilization to this incredible and peaceful getaway!  Reconnect with nature and disconnect from technology on your own private deck surroun...
/rooms/742911	https://a0.muscache.com/im/pictures/10431290/aa5f0e00_original.jpg?aki_polity=xx_large	Holiday in Toscany in the Strettoio - Apartments for Rent in Rignano sull'Arno, Tuscany, Italy	Jul 29, 2018 - Entire home/apt for $69. My apartment is very unique and well finished in the Tuscan tradition. He has his privacy in all, well tenuto.C 'kitchen is a living room of about ...
/rooms/2563430	https://a0.muscache.com/im/pictures/33799423/c93f97c9_original.jpg?aki_polity=xx_large	Your very own wee whisky barrel - Dome houses for Rent in Forres, United Kingdom	Jul 29, 2018 - Private room for $52. Spending the night in our barrel will make you feel like a hobbit living in the Shire. It can be used as a single or twin room. It's located in the...
/rooms/1340955	https://a0.muscache.com/im/pictures/7bf0b437-2bdf-48b7-b964-0ef965c2c773.jpg?aki_polity=xx_large	Heart of East Nashville Bungalow - Houses for Rent in Nashville, Tennessee, United States	Jul 29, 2018 - Entire home/apt for $178. Here is a tranquil resting place in the heart of Nashville's most happening neighborhood. A well cared-for 1920's bungalow in historic East Nashvil...
/rooms/12873798	https://a0.muscache.com/im/pictures/db119d64-04e2-428a-b4f3-a1a05dd44ed0.jpg?aki_polity=xx_large	Geodesic Dome near World Biosphere Reserve - Dome houses for Rent in Quebrada de Alvarado, Región de Valparaíso, Chile	Jul 29, 2018 - Entire home/apt for $70. Surrounded by pristine forest and powerful nature, the Dome is suspended on the estuary of Life. (Estero de la Vida). Our space is proper for peace...
/rooms/10226031	https://a0.muscache.com/im/pictures/ce7f67ea-51be-41e0-9c3d-ac73f72df0d6.jpg?aki_polity=xx_large	Contemporary Studio - Apartments for Rent in Berlin, Berlin, Germany	Jul 29, 2018 - Entire home/apt for $125. Located in the central Tiergarten district our home is a beautiful, modern, 50 sqm open space with a nice view over a privat, quiet and urban garde...
/rooms/7639807	https://a0.muscache.com/im/pictures/97004446/1159cd29_original.jpg?aki_polity=xx_large	The Studio Villa Madella. - Villas for Rent in Ubud, Bali, Indonesia	Jul 29, 2018 - Entire home/apt for $63. The Studio is a very Spacious, Elegantly designed, contemporary / Asia Style Studio 3 minutes scooter ride to over 700 restaurants in Ubud Central....
/rooms/5195894	https://a0.muscache.com/im/pictures/d0ff50fe-5145-409a-a8b7-6204ca27d296.jpg?aki_polity=xx_large	Treetop Hideaways: Luna Loft - Treehouses for Rent in Flintstone, Georgia, United States	Jul 29, 2018 - Entire home/apt for $245. This rustic and refined treehouse provides a comfortable treetop retreat. Part glamping, part boutique hotel, your climate controlled hideaway is c...
/rooms/6212524	https://a0.muscache.com/im/pictures/cf71fe9a-2184-402d-bc3a-1cfa34718e08.jpg?aki_polity=xx_large	Thatched cottage surrounded by nature - Tiny houses for Rent in Borée, Rhône-Alpes, France	Jul 29, 2018 - Entire home/apt for $64. Charming wood and stone thatched cottage nestled on the South slopes of Mont Mézenc, near Gerbier de Jonc (where the source of the Loire river is l...
/rooms/1878938	https://a0.muscache.com/im/pictures/26383903/51ff4c93_original.jpg?aki_polity=xx_large	Nordic Apt, 3 Rm , 6 mins to MRT! - Apartments for Rent in Xindian District, Taiwan	Jul 29, 2018 - Entire home/apt for $128. ★Metro/Subway mainline - - Xindian District Office Station (6 minutes walk)  ★Got TPE 101 Direct Bus in front of the house (Transit time: 20 mins...
/rooms/1229785	https://a0.muscache.com/im/pictures/19812079/c601fe9d_original.jpg?aki_polity=xx_large	FreeBikes / WIFI /FullyEquippedKitchen / Central - Apartments for Rent in Budapest, Budapest, Hungary	Jul 29, 2018 - Entire home/apt for $70. The 83 sqm flat is situated in the heart of Budapest, which is furnished by unique and design furniture. In the huge and fully equipped kitchen gue...
/rooms/1602932	https://a0.muscache.com/im/pictures/100851117/8348c46c_original.jpg?aki_polity=xx_large	Geo Dome on Farm Upstate Catskills - Yurts for Rent in Woodridge, New York, United States	Jul 29, 2018 - Entire home/apt for $350. If you like to cook, hike, swim, visit farmers markets and be surrounded by animals, this is the place for you. Woodridge is a rural community loca...
/rooms/295958	https://a0.muscache.com/im/pictures/6331728/81ef0d1c_original.jpg?aki_polity=xx_large	Mongolian yurt at the dyke of Elbe - Yurts for Rent in Hollern-Twielenfleth, Lower Saxony, Germany	Jul 29, 2018 - Entire home/apt for $76. Wintertime. The yurt is stored warm and cozy until spring. Thank you to all our guests and many interesting meetings! See you in spring!  The mongo...
/rooms/12998978	https://a0.muscache.com/im/pictures/3c121a2d-81f2-49f6-b51c-8c0573f3a159.jpg?aki_polity=xx_large	Berg, Natur - Pension Bachseitenhof - Nature lodges for Rent in Löbenau, Salzburg, Austria	Jul 29, 2018 - Private room for $34.  We are a family pension.   Our house is located at 1250 meters next to the forest, and 5 km away from the town.    The 12 comfort rooms with enclo...
/rooms/3542873	https://a0.muscache.com/im/pictures/44692730/8b7e062a_original.jpg?aki_polity=xx_large	Old tower, Hvar historical center - Windmills for Rent in Hvar, Split-Dalmatia County, Croatia	Jul 29, 2018 - Entire home/apt for $191. The Old tower is situated in Hvar`s historical centre, in a peaceful area, just a few minutes walking distance from the main town square. Tower has...
/rooms/4678535	https://a0.muscache.com/im/pictures/58744516/853f84c8_original.jpg?aki_polity=xx_large	Cozy School Bus Conversion - Tiny houses for Rent in Shepherdstown, West Virginia, United States	Jul 29, 2018 - Private room for $59. Thanks for checking out the bus.  It has been a joy to meet so many nice people since we listed it on Airbnb.  The bus is just a short walk from ou...
/rooms/select/4646142	https://a0.muscache.com/4ea/air/v2/pictures/7efe0c59-524a-4c31-8af4-4e6c80eebfb6.jpg?t=r:w2500-h1500-sfit,e:fjpg-c90	Unwind in a Bright, Airy Space with Rustic Accents - Apartments for Rent in Cape Town, Western Cape, South Africa	Jul 29, 2018 - Entire home/apt for $49. Get cosy at this quiet and secure retreat in the centre of Cape Town. Open the sliding doors to breathe in the ocean air after preparing a meal in ...
/rooms/3397465	https://a0.muscache.com/im/pictures/45263405/8ac7b23f_original.jpg?aki_polity=xx_large	Apartamento junto Gran Vía - Apartments for Rent in Madrid, Community of Madrid, Spain	Jul 29, 2018 - Entire home/apt for $82.  The apartment is semidiáfano - 40 m2 - distributed in two rooms and bathroom. It has a small living room with table and chairs to eat or relax. Th...
/rooms/1838274	https://a0.muscache.com/im/pictures/53992414/64510035_original.jpg?aki_polity=xx_large	Lussuoso. Vista incantevole. - Apartments for Rent in Riva, Lombardy, Italy	Jul 29, 2018 - Entire home/apt for $58.  Apartment overlooking the new and luxurious lake in residence with pool open in summer from June 15 to September 15, tennis court, bowling alley a...
/rooms/919169	https://a0.muscache.com/im/pictures/44897871/b36d86f9_original.jpg?aki_polity=xx_large	Cosy Guest room with access to The Owl House ! - Huts for Rent in Hightown, United Kingdom	Jul 29, 2018 - Private room for $111. A unique place in my home, the guest room, inside my bungalow, is cosy & warm with a very comfortable driftwood bed, a private shower & toilet is a...
/rooms/12148992	https://a0.muscache.com/im/pictures/c7e714bb-0bff-4cd1-b96c-89beed9eb2bf.jpg?aki_polity=xx_large	Modern Beach Container Home #2 - Tiny houses for Rent in Carolina Beach, North Carolina, United States	Jul 29, 2018 - Entire home/apt for $125. Located a short walk from the beach, these modern container homes offer everything a couple or small family could want for a fun surf trip or beach...
/rooms/13534809	https://a0.muscache.com/im/pictures/4b6376f9-8d95-4e33-b6fb-0eb56bcda75d.jpg?aki_polity=xx_large	慢囤囤1号房:温州第一批历史建筑 纱帽河朱氏民居四合院loft小屋（整套独立卫生间） - Tiny houses for Rent in Wenzhou, Zhejiang, China	Jul 29, 2018 - Entire home/apt for $33.  Siheyuan is located in the most prosperous area in Wenzhou yarn Hat River (Ladies' Street)   It is 180 meters from Renmin Road (bus station) in do...
