/rooms/2535184	https://a0.muscache.com/im/pictures/40056652/b5501a2c_original.jpg?aki_polity=xx_large	Monastery dated XII century - Villas for Rent in Florence, Tuscany, Italy	Jul 29, 2018 - Private room for $80. The apartment is part of a Monastery dated back XII century and it's under the Fine Art of Florence. The room is located on the first floor and it'...
/rooms/4521518	https://a0.muscache.com/im/pictures/56772998/fb468ae6_original.jpg?aki_polity=xx_large	Knysna Houseboat Myrtle - Boats for Rent in Knysna, Western Cape, South Africa	Jul 29, 2018 - Entire home/apt for $95. Houseboat Myrtle is a totally self-contained wooden cottage on the water. Permanently Anchored in the Knysna Lagoon, it’s a two minute dinghy ride ...
/rooms/select/272282	https://a0.muscache.com/4ea/air/v2/pictures/52a1e88d-c589-4d88-a0b0-a106270d00f1.jpg?t=r:w2500-h1500-sfit,e:fjpg-c90	Exquisito apartamento con espacios abiertos y luz - Apartments for Rent in Barcelona, Catalunya, Spain	Jul 29, 2018 - Entire home/apt for $338.  The best option for your trip is to stay in this spacious apartment, with lots of natural light and perfectly located in the center of the city. A...
/rooms/9678942	https://a0.muscache.com/im/pictures/232c45fc-ca71-4370-bd88-cafd2597d0e5.jpg?aki_polity=xx_large	The River Den - Boats for Rent in Wakefield, Quebec, Canada	Jul 29, 2018 - Entire home/apt for $88. The River Den is a 4 season houseboat, docked in picturesque Wakefield, Qc on the Gatineau River. This dream boat is a floating tiny house which do...
/rooms/86511	https://a0.muscache.com/im/pictures/1119212/419b0426_original.jpg?aki_polity=xx_large	garden loft apartment downtown Flo - Lofts for Rent in Florence, Tuscany, Italy	Jul 29, 2018 - Entire home/apt for $157. Located in the historic centre of Florence lies La Magione, a haven of peace in the midst of a monumental garden, apparently miles away from the no...
/rooms/4176197	https://a0.muscache.com/im/pictures/57222658/b3fe0365_original.jpg?aki_polity=xx_large	Tuscan Apt in the heart of Florence - Apartments for Rent in Florence, Tuscany, Italy	Jul 29, 2018 - Entire home/apt for $111. Our home has a perfect Tuscan feeling with its exposed brickwork and glass door facing onto a beautiful garden. Located in the heart of Florence bu...
/rooms/7090897	https://a0.muscache.com/im/pictures/90448847/90608d5a_original.jpg?aki_polity=xx_large	Sunscape apartment 2- Modern & cozy - Apartments for Rent in Split, Splitsko-dalmatinska županija, Croatia	Jul 29, 2018 - Entire home/apt for $45. Walking distance from the major tourist sites- Diocletian palace, Riva promenade, Marjan forest park, Lučice Yacth marina & beaches, famous Ultra f...
/rooms/2128248	https://a0.muscache.com/im/pictures/66731946/dcd6a0af_original.jpg?aki_polity=xx_large	PROMO -33%OFF Magic Trip Seminyak - Villas for Rent in Kuta, Bali, Indonesia	Jul 29, 2018 - Entire home/apt for $239. Luxurious private 3bd villa located in the heart of Seminyak. Private swimming pool 2,6×8m; built in kitchen; wi-fi internet; within walking distan...
/rooms/2433060	https://a0.muscache.com/im/pictures/79452273/12bc436d_original.jpg?aki_polity=xx_large	City Penthouse in Central Cape Town - Apartments for Rent in Cape Town, Western Cape, South Africa	Jul 29, 2018 - Entire home/apt for $98. Modern open plan super spacious penthouses in historic Cape Town . Windows from floor to ceiling to give you the best views of Cape Town and full v...
/rooms/6884177	https://a0.muscache.com/im/pictures/87605606/086c7283_original.jpg?aki_polity=xx_large	Deluxe King Bedroom Louis XIV - Apartments for Rent in Edinburgh, Midlothian, United Kingdom	Jul 29, 2018 - Private room for $56. A light and spacious Double room on the first floor with king size bed. Louis XIV themed furnishing and decor. Full Virgin Media package and Wifi. ...
/rooms/7714613	https://a0.muscache.com/im/pictures/100860965/3ef146a1_original.jpg?aki_polity=xx_large	La Coccinella - studio in downtown - Apartments for Rent in Budapest, Budapest, Hungary	Jul 29, 2018 - Entire home/apt for $40. Enjoy this brand new studio flat with AC in the picturesque downtown of Budapest, in the 5th quarter in between Gellert and Elisabeth bridge.  Apar...
/rooms/5917093	https://a0.muscache.com/im/pictures/85906047/cb8a5532_original.jpg?aki_polity=xx_large	Tiny Lakefront Cabin....trails, boating, birding. - Tiny houses for Rent in Cape May Court House, New Jersey, United States	Jul 29, 2018 - Entire home/apt for $149. One of the best Airbnb experiences we've ever had.  ~ Sept  2017  Absolutely amazing, incredibly clean and comfortable. ~ Jan 2017  More than a...
/rooms/6075146	https://a0.muscache.com/im/pictures/76496357/1046f2aa_original.jpg?aki_polity=xx_large	Yablanitsa Balkan Huts-3 Guests + Breakfast - Huts for Rent in Yablanitsa, Lovec, Bulgaria	Jul 29, 2018 - Entire home/apt for $41. - Entire house, breakfast incl. - 1 Double bed (2 persons) - 1 Single bed - Bathroom and WC facilities - in separate premises (please see the pictu...
/rooms/8893375	https://a0.muscache.com/airbnb/static/logos/trips-og-1280x630-9de9c338cc3fd9b5663fb80be0cbe8c2.jpg	Vacation Rentals, Homes, Experiences & Places - Airbnb	Unforgettable trips start with Airbnb. Find adventures nearby or in faraway places and access unique homes, experiences, and places around the world.
/rooms/11160077	https://a0.muscache.com/im/pictures/ff72c913-b6ec-487d-b6b4-fda1975704a0.jpg?aki_polity=xx_large	Homeboat Glamping Loft on the water - Boats for Rent in Nieuwpoort, Vlaanderen, Belgium	Jul 29, 2018 - Entire home/apt for $175. Charming modern designed Homeboat - concept of  comfortable living on the water - located in the countryside on a channel - appartment 46 sqm and 3...
/rooms/39516	https://a0.muscache.com/im/pictures/23739986/da2fb705_original.jpg?aki_polity=xx_large	Art Studio Retreat/Rustic Cabin - Tiny houses for Rent in San Diego, California, United States	Jul 29, 2018 - Entire home/apt for $69. We love having explorers from all over the world to bring good energy into the art studio! If you are an experienced camper, you'll be so happy her...
/rooms/349999	https://a0.muscache.com/im/pictures/3874666/62b8cb27_original.jpg?aki_polity=xx_large	Romantic cottage in Carinthia  - Huts for Rent in Trieblach, Carinthia, Austria	Jul 29, 2018 - Entire home/apt for $115. Ein original Troadkasten, ausgebaut zu einer komfortablen Hütte. Ideal für 2 Personen, die gerne das Landleben und die schöne Kärntner Landschaft g...
/rooms/621213	https://a0.muscache.com/im/pictures/8328396/75eb5b6e_original.jpg?aki_polity=xx_large	Noosa Tree Top Eco Retreat - Treehouses for Rent in Sunrise Beach, Queensland, Australia	Jul 29, 2018 - Private room for $110. BUSH TO BEACH-a place to call your home for a while..... The Tree Top Eco Retreat has its own private entrance. The bedroom is fully enclosed with ...
/rooms/136891	https://a0.muscache.com/im/pictures/3997843/0f101446_original.jpg?aki_polity=xx_large	Old Tower, lake view, swimming pool - Castles for Rent in Tuoro sul Trasimeno, Umbria, Italy	Jul 29, 2018 - Entire home/apt for $87. The small tower can accommodate two people comfortably, nestled in the Umbrian and Tuscan countryside, in a protected area for the natural scenic b...
/rooms/2311466	https://a0.muscache.com/im/pictures/54335902/8572cc9d_original.jpg?aki_polity=xx_large	The Lake Tahoe Chalet - Chalets for Rent in South Lake Tahoe, California, United States	Jul 29, 2018 - Entire home/apt for $175. Be surrounded by nature and yet have all the comforts of home. Be our guest in this cozy log cabin surrounded by tall pines and mountains, and yet ...
/rooms/6334264	https://a0.muscache.com/im/pictures/79203729/6b62a5c8_original.jpg?aki_polity=xx_large	Lovely flat*** Ste Catherine street - Apartments for Rent in Bordeaux, Aquitaine, France	Jul 29, 2018 - Entire home/apt for $82. Lovely flat of 30 m² ideally situated in the center of Bordeaux, on Sainte Catherine street, next to the Grand Theatre. Apartment very modern and w...
/rooms/4351047	https://a0.muscache.com/im/pictures/62102550/3450e4d7_original.jpg?aki_polity=xx_large	Ocean View Malibu Hideaway - Guest suites for Rent in Malibu, California, United States	Jul 29, 2018 - Entire home/apt for $225. A delightful experience often compared with the French Riviera, incredible ocean views. Conveniently located only 23 miles from Los Angeles Interna...
/rooms/8728954	https://a0.muscache.com/im/pictures/110652691/c2736730_original.jpg?aki_polity=xx_large	大理洱海门1号酒店星空房 - Houses for Rent in Dali, Yunnan, China	Jul 29, 2018 - Private room for $44.  Thank you for your love, star room to become the number one place in Dali accommodation. Guests stay three years, the star room has the following ...
/rooms/18627194	https://a0.muscache.com/im/pictures/5694b105-e2f2-4b7d-b52f-ea2cb2885008.jpg?aki_polity=xx_large	Montana Treehouse Retreat @Gateway to Glacier Park - Treehouses for Rent in Columbia Falls, Montana, United States	Jul 29, 2018 - Entire home/apt for $299. Montana Treehouse Retreat: FEATURED On The Treehouse Guys on DIY Network! Nestled on a private wooded 7 acres, this artistically designed double de...
/rooms/5387742	https://a0.muscache.com/im/pictures/72134628/fb92b0cb_original.jpg?aki_polity=xx_large	Spacious 1 BR in hip cool NEPO - Boutique hotels for Rent in Portland, Oregon, United States	Jul 29, 2018 - Private room for $81. Where Bali meets Portland. Come relax in this newly, beautifully designed, private mixed use accommodation. Just five short blocks from Portland's ...
/rooms/353751	https://a0.muscache.com/im/pictures/3929060/97391462_original.jpg?aki_polity=xx_large	Château de Barnay - South Burgundy - Castles for Rent in Saint-Martin-de-Lixy, Bourgogne Franche-Comté, France	Jul 29, 2018 - Entire home/apt for $146. Yellow stones, French ceilings, spiral staircase, large fireplaces marked with the seal of the Templars. A timeless place to live exceptional holid...
/rooms/270050	https://a0.muscache.com/im/pictures/13206216/24ebd66e_original.jpg?aki_polity=xx_large	Double Room in El vaixell de paper - Apartments for Rent in Barcelona, Catalonia, Spain	Jul 29, 2018 - Private room for $56. Una habitación doble en un apartamento tranquilo situada en un edificio histórico que data de la época medieval. A pocos metros se situan el Museo ...
/rooms/156247	https://a0.muscache.com/im/pictures/23884483/91d67209_original.jpg?aki_polity=xx_large	Exceptional property private beach - Cottages for Rent in Governador Celso Ramos, Santa Catarina, Brazil	Jul 29, 2018 - Entire home/apt for $79. The house is located in a beautiful natural park, fully enclosed, supervised by a couple of caseiros (caretaker and gardener)  NB: Price per pers...
/rooms/17716034	https://a0.muscache.com/im/pictures/4776c877-51fc-49d3-a9af-9111bcad472e.jpg?aki_polity=xx_large	Stunning Leslieville Loft w Private Outdoor Oasis! - Apartments for Rent in Toronto, Ontario, Canada	Jul 29, 2018 - Entire home/apt for $115. Welcome to Awesome! This stunning, recently renovated loft is spacious, bright & ready to welcome you. The Chef's kitchen features a BlendTec Blend...
/rooms/355474	https://a0.muscache.com/im/pictures/4084180/e5bc5484_original.jpg?aki_polity=xx_large	Romantic Suite in family home in Valparaiso, Chile in Valparaiso, Valparaiso, Chile	Jul 29, 2018 - Private room for $60. We offer a beautiful and romantic Suite with view to the Pacific Ocean in a family home in the UNESCO Heritage city of Valparaiso, Chile, South Ame...
/rooms/278614	https://a0.muscache.com/im/pictures/38330412/2dfa580c_original.jpg?aki_polity=xx_large	directly in the green Taunus - Tiny houses for Rent in Neu-Anspach, Hesse, Germany	Jul 29, 2018 - Entire home/apt for $92. In our cozy Summer Häus'l with natural stone, wood fireplace, and a small kitchen can dangle in full nature the soul. A covered terrace allows sm...
/rooms/2218976	https://a0.muscache.com/im/pictures/c3daac7d-14a3-448c-bd9e-5ac6b5144308.jpg?aki_polity=xx_large	BOUTIQUE apt in DOWNTOWN AREA - 100m2 with AC - Lofts for Rent in Prague, Hlavní město Praha, Czech Republic	Jul 29, 2018 - Entire home/apt for $66. My warm, lovely boutique 1 bedroom 100m2 apartment is located in lively & centraly located Bohemian Zizkov district, which is packed with amazing c...
/rooms/4869137	https://a0.muscache.com/im/pictures/0ae86008-3d46-4fbb-9baf-466cf7320bab.jpg?aki_polity=xx_large	Bird Island - Placencia, Belize - Islands for Rent in Stann Creek Dist, Belize, Belize	Jul 29, 2018 - Entire home/apt for $495. Stay on your very own in a beautiful location inside one of Belize's finest atolls (6 miles from the mainland) in a comfortable setting, and with e...
/rooms/8319626	https://a0.muscache.com/im/pictures/930b2498-a62b-420b-8e5d-a2b5e4447516.jpg?aki_polity=xx_large	BOLT FARM TREEHOUSE romantic, luxury eco-retreat! - Treehouses for Rent in Walhalla, South Carolina, United States	Jul 29, 2018 - Entire home/apt for $395. LIVE LIKE KINGS & PLAY LIKE KIDS in this extraordinary, award-winning treehouse hidden in 40 acres of paradise! Cozy, whimsical & glamorous; 2 conn...
/rooms/369034	https://a0.muscache.com/im/pictures/18813125/896b30c2_original.jpg?aki_polity=xx_large	Stylish house close to river thames - Houses for Rent in London, United Kingdom	Jul 29, 2018 - Private room for $85. Lovely warm comfortable and stylishly furnished house. Private bedroom and bathroom with use of kitchen/breakfast room.  Double and single bedroom ...
/rooms/9624594	https://a0.muscache.com/im/pictures/46816803-926f-44d2-af43-cf9a576ef866.jpg?aki_polity=xx_large	Selvista: Jungle House volcano view luxury 2storey - Nature lodges for Rent in Balgüe, Rivas, Nicaragua	Jul 29, 2018 - Private room for $105. Low season discounts NOW! Soak in the barefoot luxury in Jungle House 2nd & 3rd floors, on the slopes of the Maderas volcano on Isla de Ometepe, ...
/rooms/18649731	https://a0.muscache.com/im/pictures/2afe2cdf-b978-4295-82e6-b3997d9ca5eb.jpg?aki_polity=xx_large	Urban Tranquilatree - Treehouses for Rent in Cork, County Cork, Ireland	Jul 29, 2018 - Entire home/apt for $152. This is a real tree house, fully insulated, supported by real trees 6m off the ground. It is south facing with spectacular views over Cork city. It...
/rooms/1177492	https://a0.muscache.com/im/pictures/18050268/e9ce12db_original.jpg?aki_polity=xx_large	Trad Studio Appt -  Central Athens - Earth houses for Rent in Athens, Attica, Greece	Jul 29, 2018 - Entire home/apt for $41. Traditional recently renovated Studio Appartment in Mets, a historic,beautiful and quiet area with steep streets in the heart of Athens. -The locat...
/rooms/433392	https://a0.muscache.com/im/pictures/828dbfd7-1259-413c-b99e-a9629d06a040.jpg?aki_polity=xx_large	Hector Cave House - Caves for Rent in Santorini, Central Greece, Greece	Jul 29, 2018 - Entire home/apt for $460. Hector Cave House, carved into the unique caldera cliff for more than 250 years, was originally used as a wine cellar. Then it became a family owne...
/rooms/5155854	https://a0.muscache.com/im/pictures/46586126-3238-472a-aa00-d2f300f89bba.jpg?aki_polity=xx_large	NEW, SANGLUNG VILLA NORTH BALI... - Villas for Rent in Sanglung, Bali, Indonesia	Jul 29, 2018 - Entire home/apt for $179. This is our latest villa and is finished in September 2015 just 100 meters from our other 2 villas The villas have the exact same luxuries and view...
/rooms/4694846	https://a0.muscache.com/im/pictures/1faf9a4c-f839-44da-bd37-65ddc928379e.jpg?aki_polity=xx_large	180° VIEW, PRIVATE POOL VILLA.. - Villas for Rent in Singaraja, Bali, Indonesia	Jul 29, 2018 - Entire home/apt for $129. The villa sits in an elevated postion in one of the last remaining untouched parts of the island.  Brand new luxury villa in North Bali with stunni...
/rooms/6476113	https://a0.muscache.com/im/pictures/81344949/4e1c0997_original.jpg?aki_polity=xx_large	Private room in the center of city - Apartments for Rent in Porto, Porto, Portugal	Jul 29, 2018 - Private room for $26. The apartment is very well located, near of most all touristic things here in the center of the city!!!  The room is private very comfortable with ...
/rooms/4806556	https://a0.muscache.com/im/pictures/89672613/e5945018_original.jpg?aki_polity=xx_large	Houseboat near city center - Boats for Rent in Amsterdam, Noord-Holland, Netherlands	Jul 29, 2018 - Entire home/apt for $175. Stay on an Amsterdam canal in a very comfortable houseboat on walking distance from the historic center of the city, museum district, city park , c...
/rooms/13042719	https://a0.muscache.com/im/pictures/8c3a0a05-d5db-4e7f-878a-3b3ad7f63343.jpg?aki_polity=xx_large	Charming 2 bed house & parking on pretty street - Houses for Rent in Edinburgh, United Kingdom	Jul 29, 2018 - Entire home/apt for $170. Beautiful two bedroom, two bathroom mews house with private garage for parking.  Located on a quaint, cobbled street tucked away in the heart of St...
/rooms/4943665	https://a0.muscache.com/im/pictures/106794278/58d1785b_original.jpg?aki_polity=xx_large	7 BEDS in Artist's Home, just 3 MILES TO DOWNTOWN! - Houses for Rent in Nashville, Tennessee, United States	Jul 29, 2018 - Entire home/apt for $160. Welcome to my creative retreat JUST 3 miles or an $8 Uber ride to the “Honkytonks downtown Broadway! You allow me to live my dream as an artist, b...
/rooms/17525913	https://a0.muscache.com/im/pictures/1c131f1c-becb-44d5-b459-6aaf7d8d07ad.jpg?aki_polity=xx_large	NEW Bali villa Umalas / Seminyak - 5mins to beach - Villas for Rent in Umalas, Bali, Indonesia	Jul 29, 2018 - Entire home/apt for $487. Antara Villa offers luxury accommodation for your tropical getaway. Relax by the sun-drenched private pool, or unwind with a cocktail in the tranqu...
/rooms/16492453	https://a0.muscache.com/im/pictures/a538132f-f333-4313-91da-335fe9841bc8.jpg?aki_polity=xx_large	I would definitely choose this one if I were you. - Apartments for Rent in Seattle, Washington, United States	Jul 29, 2018 - Private room for $75. Beautiful apartment, within walking distance of parks, bars, museums and downtown.   This is the perfect place if you are looking to feel super com...
/rooms/342074	https://a0.muscache.com/im/pictures/3898743/a70e3172_original.jpg?aki_polity=xx_large	In the historical center of Lecce - Houses for Rent in Lecce, Apúlia, Italy	Jul 29, 2018 - Entire home/apt for $87.    Detached house situated in a quiet area of the historical center: a few steps from the church of Santa Croce, the best example of Lecce Baroque,...
/rooms/675736	https://a0.muscache.com/im/pictures/22296424/98d8eabd_original.jpg?aki_polity=xx_large	Relaxing Holiday in Yurt - Yurts for Rent in Chlum, Karlovy Vary Region, Czech Republic	Jul 29, 2018 - Entire home/apt for $70. Pure nature and relaxation ... All this can be found in our lovingly decorated, comfortable yurt . Relax and unwind...  Do you want to experience a...
/rooms/1697780	https://a0.muscache.com/im/pictures/25735497/948807b4_original.jpg?aki_polity=xx_large	Designer Loft Bangkok Silom - Apartments for Rent in Bangkok, Bangkok, Thailand	Jul 29, 2018 - Entire home/apt for $81. Discover daily local life in city center, friendly neighborhood, clandestine casino, karaoke, old-style artisans, art gallery and artist studio dow...
/rooms/4439461	https://a0.muscache.com/im/pictures/57115517/3bdd93e6_original.jpg?aki_polity=xx_large	Upscale Private Ensuite Bed & Bath - Houses for Rent in San Francisco, California, United States	Jul 29, 2018 - Private room for $129. Welcome - newly remodeled private bedroom with queen bed & spa-like bath/shower over tub. Located inside a recently renovated Victorian in Pacific ...
/rooms/833937	https://a0.muscache.com/im/pictures/11919027/181f9b2b_original.jpg?aki_polity=xx_large	Sunny Home in Historic Curtis Park - Houses for Rent in Denver, Colorado, United States	Jul 29, 2018 - Entire home/apt for $128. A lovely little victorian cottage in the Historic Curtis Park neighborhood features a sunny kitchen, 2 bedrooms, solar power, vegetable garden. 1 b...
/rooms/68290	https://a0.muscache.com/im/pictures/1eb1ad0f-87e6-4b2c-b60b-1e35cafd9035.jpg?aki_polity=xx_large	Rebel - Private Room - Serviced apartments for Rent in Amsterdam, NH, Netherlands	Jul 29, 2018 - Private room for $127. ★ Location - The best ★ Room - In a '16th century' apartment ★ Internet connection - Fastest available ★ SuperHost - AirBnB chosen few ★ Not satisf...
/rooms/9859896	https://a0.muscache.com/im/pictures/ad790e18-8ba0-4ffe-a695-48e10076851e.jpg?aki_polity=xx_large	Castel in the Loire Valley - Castles for Rent in Saint-Georges-sur-Cher, Centre, France	Jul 29, 2018 - Entire home/apt for $350. Feel like a real castle owner in the middle of Loire Valley. This castel with seduce you for an entire group or just in family for your week-ends o...
/rooms/434618	https://a0.muscache.com/im/pictures/520fe745-5b1d-4c2d-8bad-6a6f8a9905e6.jpg?aki_polity=xx_large	Private Oregon Roundhouse … Not in a Box! - Tiny houses for Rent in Eugene, Oregon, United States	Jul 29, 2018 - Entire home/apt for $48. If you've never slept in the round before, you owe yourself! We all want to think outside the box, but how about sleeping outside the box? — well...
/rooms/1475688	https://a0.muscache.com/im/pictures/56ed891d-6b84-4cc5-903e-9f726c673f1b.jpg?aki_polity=xx_large	BEST LOCATION AND VIEW!!! PARKING - Apartments for Rent in Prague, Prague, Czech Republic	Jul 29, 2018 - Entire home/apt for $170. REQUEST FREE PARKING BEFORE BOOKING PLEASE. Simply the best location and view you can get. There is nothing better. Do not hesitate to book this ve...
/rooms/819535	https://a0.muscache.com/im/pictures/13937905/63f6e0c9_original.jpg?aki_polity=xx_large	Clérigos Room in Historic Building - Hostels for Rent in Porto, Porto District, Portugal	Jul 29, 2018 - Private room for $35. This room is located in an historic and classified building by Unesco in Porto. It is located  near the famous Clérigos Tower and it is just above ...
/rooms/10149765	https://a0.muscache.com/im/pictures/13a10051-44ae-40c4-8a0c-0ad8054cee6e.jpg?aki_polity=xx_large	Beautiful Loft! Steps to Trendy King & Queen West! - Lofts for Rent in Toronto, Ontario, Canada	Jul 29, 2018 - Entire home/apt for $131. This bohemian style artist's loft space has tons of character. Tucked away in a 150-year-old historical casket factory, the building has been conve...
/rooms/2207040	https://a0.muscache.com/im/pictures/11eb919c-086e-4d56-9bf9-65d6b64245d5.jpg?aki_polity=xx_large	Sanson Terrace "off-grid tiny cottage" - Tiny houses for Rent in Sakuho, Minamisaku District, Nagano Prefecture, Japan	Jul 29, 2018 - Entire home/apt for $90. In Ohinata, Sakuho-town, Nagano-pref.  We built a small cottage at a mountain side of the natural woodland which separated for a while from the col...
/rooms/7296109	https://a0.muscache.com/im/pictures/20c475bf-5ef0-4df6-b5c5-3985af585568.jpg?aki_polity=xx_large	A++ REVIEWS - LUX 3 BR SEMINYAK POOL VILLA + BEACH - Villas for Rent in Kuta, Bali, Indonesia	Jul 29, 2018 - Entire home/apt for $122. → Stylish serviced villa in prime Seminyak neighbourhood with everything on doorstep → Walk to Seminyak beach & popular restaurants, cafes & shops ...
/rooms/283638	https://a0.muscache.com/im/pictures/6174600/15fb85b3_original.jpg?aki_polity=xx_large	Unique Architecture Cave House - Cycladic houses (Greece) for Rent in Oia, South Aegean, Greece	Jul 29, 2018 - Entire home/apt for $492. This spacious, unparalleled cave house, hanging on the cliffs of the caldera in the center of Oia, is part of a traditional complex of cave houses,...
/rooms/1730089	https://a0.muscache.com/im/pictures/25304059/5f090332_original.jpg?aki_polity=xx_large	Treehouse Canopy Room: Permaculture Farm - Treehouses for Rent in Miami, Florida, United States	Jul 29, 2018 - Private room for $65. Our lovely space is a lush urban oasis and permaculture farm.  Enjoy  goats, pigs, emus, roosters, cats, and friendly  people.  Located in Little ...
/rooms/457547	https://a0.muscache.com/im/pictures/85802494/b85455c2_original.jpg?aki_polity=xx_large	Off-grid Adobe Dome in the Desert - Earth houses for Rent in Terlingua, Texas, United States	Jul 29, 2018 - Entire home/apt for $88. A remote, off-grid adobe dome, powered by solar power, and near Big Bend National Park.  Thanks to HGTV for taking an interest and for featuring th...
/rooms/6168679	https://a0.muscache.com/im/pictures/97594001/6a9db9f3_original.jpg?aki_polity=xx_large	Garden refuge in style - Tiny houses for Rent in Naunton, Cheltenham, Gloucestershire, United Kingdom	Jul 29, 2018 - Entire home/apt for $102. This cabin has the feel of a true hideaway. With the light of the pond outside reflecting on the ceiling, you could be anywhere. 1 double bed and a...
/rooms/6063023	https://a0.muscache.com/im/pictures/82185280/a798f56d_original.jpg?aki_polity=xx_large	PORTA 33 - THE FLAT PORTO - Apartments for Rent in Porto, Porto, Portugal	Jul 29, 2018 - Entire home/apt for $114. “The Flat” is located in a central area of the city, in the hearth of “Bairro das Artes”, two minutes walking from the known street “Miguel Bombard...
/rooms/11669517	https://a0.muscache.com/im/pictures/9ff0eac9-ff66-4656-bfe0-21c00d29a5a7.jpg?aki_polity=xx_large	Lato Lato Resort - Islands for Rent in Semporna, Sabah, Malaysia	Jul 29, 2018 - Entire home/apt for $35. 如果您无法选择您想要的日期，请联系我寻求帮助。我会为你找到一个房间.  Noted : If you see date selection not available, please contact us for help.  Staying here is an unforgettable ...
/rooms/5450864	https://a0.muscache.com/im/pictures/68047801/0d509d7a_original.jpg?aki_polity=xx_large	ACUSA SECA CAVE HOUSE - Caves for Rent in Artenara, Canarias, Spain	Jul 29, 2018 - Entire home/apt for $70. Stunning accommodation in an even more amazing setting: experience the unique spirit of a cave dwelling with roots reaching back into the 6th centu...
