/rooms/443684	https://a0.muscache.com/im/pictures/16938962/5b8df046_original.jpg?aki_polity=xx_large	Penthouse, 4-5 rooms + 5 balconies - Apartments for Rent in Copenhagen, Denmark	Jul 29, 2018 - Entire home/apt for $233. The apartment is large and with lots of sunlight. It has 5 small balconies and one terrace. There are 3 rooms, a small, middle and a large. In addi...
/rooms/6105021	https://a0.muscache.com/im/pictures/0c321dfe-0e70-4d58-a42a-ae152950c920.jpg?aki_polity=xx_large	SEATTLE LOFT GUEST HOUSE - Guesthouses for Rent in Seattle, Washington, United States	Jul 29, 2018 - Entire home/apt for $99. An oasis minutes from downtown, this loft guest house is it's own unique space with an open floor plan, tall ceilings with lots of natural light, g...
/rooms/295694	https://a0.muscache.com/im/pictures/3208814/3f925f36_original.jpg?aki_polity=xx_large	Rustic Tiny Home w Sleeping Loft in hip Woodlawn - Tiny houses for Rent in Portland, Oregon, United States	Jul 29, 2018 - Entire home/apt for $70. This wonderful, private little gem is just a few easy walking blocks from plentiful drinking, dining, dispensing, yoga & coffee spots. You will be ...
/rooms/13340713	https://a0.muscache.com/im/pictures/bd544e3f-31f3-4d17-a339-373620b4037a.jpg?aki_polity=xx_large	Superb duplex apartment in the historical centre - Lofts for Rent in Bordeaux, Nouvelle-Aquitaine, France	Jul 29, 2018 - Entire home/apt for $152. Located in the middle of Bordeaux, in a very nice classified 18th building, nice flat of 50m2 renovated.  Ancient benefits.  3rd and top floor with...
/rooms/543988	https://a0.muscache.com/im/pictures/6623033/cb0ddb5e_original.jpg?aki_polity=xx_large	Quaint English Cottage Garden Apt. - Houses for Rent in Portland, Oregon, United States	Jul 29, 2018 - Entire home/apt for $95. This quaint totally furnished garden cottage, one bedroom apt. is private with it's own key, private entrance, and courtyard in the downstairs of o...
/rooms/518319	https://a0.muscache.com/im/pictures/6232566/868f98b9_original.jpg?aki_polity=xx_large	Domed Cave House in Catalunya - Earth houses for Rent in Tivenys, Catalonia, Spain	Jul 29, 2018 - Entire home/apt for $84. This holiday home is about one thing: peace. If you enjoy the sound of your own thoughts to the back drop of the breeze through leaves, this place ...
/rooms/13041989	https://a0.muscache.com/im/pictures/ac04c329-b4a7-4cc3-92a2-bd0cd60c6363.jpg?aki_polity=xx_large	The Roosevelt Suite - Garden Studio - Apartments for Rent in Chicago, Illinois, United States	Jul 29, 2018 - Entire home/apt for $90. A breezy, charming garden level studio, one block from the train, off the Boulevard System, and blocks from Lagunitas Brewery, Cinespace, and Dougl...
/rooms/3940838	https://a0.muscache.com/im/pictures/02123429-ee73-44cd-b7e9-a6995d7815e0.jpg?aki_polity=xx_large	Glamping in a Travellers Delight Tent @ Urbancamp - Tents for Rent in Windhoek, Khomas, Namibia	Jul 29, 2018 - Private room for $42. Urbancamp is a centrally located comfortable camping ground situated in the heart of Windhoek. Big shady trees, Wi-Fi internet, nice bathrooms and ...
/rooms/1352131	https://a0.muscache.com/im/pictures/350b7cc9-2b2d-4a0d-bcc6-26d1fa05934c.jpg?aki_polity=xx_large	MY LITTLE PARIS IN LOS ANGELES - Lofts for Rent in Los Angeles, California, United States	Jul 29, 2018 - Entire home/apt for $135. NO FILMING, PHOTOGRAPHY OR PARTIES, THANKS  MY LITTLE PARIS IN LOS ANGELES. BONJOUR, and welcome to my Parisian accented flat in downtown Los Angel...
/rooms/3058631	https://a0.muscache.com/im/pictures/39635618/efd17c53_original.jpg?aki_polity=xx_large	Private Studio in Sol, Madrid - Apartments for Rent in Madrid, Community of Madrid, Spain	Jul 29, 2018 - Entire home/apt for $78. We are offering a clean, well presented and recently refurbished double studio situated in the heart of Madrid, Spain.  Sol square is just 2 minute...
/rooms/8080050	https://a0.muscache.com/im/pictures/102978384/9e958b1f_original.jpg?aki_polity=xx_large	Woodbine Retreat - Houses for Rent in Nashville, Tennessee, United States	Jul 29, 2018 - Entire home/apt for $200. Home away from home: a spacious, light-filled getaway 12 minutes from the airport and downtown. Breezy front porch with swing, chairs, and hammock;...
/rooms/3452906	https://a0.muscache.com/im/pictures/73368546/af764970_original.jpg?aki_polity=xx_large	Sakura River Inn 2 (licenced Machiya) - Apartments for Rent in Kyōto, Kyōto, Japan	Jul 29, 2018 - Entire home/apt for $225. This apartment is upper floor of the other  apartment Sakura River View APT. Room size, layout, quality of futon, services, etc.. are the almost ...
/rooms/403641	https://a0.muscache.com/im/pictures/4913397/d2084422_original.jpg?aki_polity=xx_large	Douro Villa with swimming pool, Penafiel, Portugal - Houses for Rent in Penafiel, Porto, Portugal	Jul 29, 2018 - Entire home/apt for $338. We invite you to come and visit our beautiful countryside house on the shores of the Douro river. You will have a full countryside experience with ...
/rooms/17240712	https://a0.muscache.com/im/pictures/dde35ea6-819c-498f-be8b-fa26dbf61bbd.jpg?aki_polity=xx_large	Designer Retreat in the Heart of Mebourne - Apartments for Rent in Melbourne, Victoria, Australia	Jul 29, 2018 - Entire home/apt for $117. Stay in the absolute centre of Melbourne when you book this freshly renovated, quirky & bright, heritage style apartment. Located right next-door t...
/rooms/65010	https://a0.muscache.com/im/pictures/8793de52-884d-4147-9bcf-57369acc5841.jpg?aki_polity=xx_large	YURT*mtn*STARS*Hot Tub*HIKING*GOATS*farmstead. - Yurts for Rent in Stanardsville, Virginia, United States	Jul 29, 2018 - Entire home/apt for $185. Come experience living in a round structure filled with amenities-fully equipped kitchen, deep tub, heating and AC, shared hot tub and seasonal sal...
/rooms/847794	https://a0.muscache.com/im/pictures/50226263/1514a6b6_original.jpg?aki_polity=xx_large	Skylit Loft in Old Montreal - Lofts for Rent in Montreal, Quebec, Canada	Jul 29, 2018 - Entire home/apt for $176. LOFT -Gorgeous early 19th century factory converted into lofts. -3 skylights in loft provide plenty of natural sunlight. -Accommodates 2 guests max...
/rooms/13388355	https://a0.muscache.com/im/pictures/167e7786-76a9-4b38-9f4f-6ed14eeaaa7c.jpg?aki_polity=xx_large	Cabane perchée "Au Bois d'Emma & Loue" Tree house - Treehouses for Rent in Éauze, Languedoc-Roussillon-Midi-Pyrénées, France	Jul 29, 2018 - Entire home/apt for $206.  Open all year!   A single Hut Perched between 10-12m (without pilings) with SPA OPTIONAL.   You will have access to our hut with dry toilets, to i...
/rooms/8357	https://a0.muscache.com/im/pictures/140333/3ab8f121_original.jpg?aki_polity=xx_large	Mushroom Dome Cabin: #1  on airbnb in the world - Dome houses for Rent in Aptos, California, United States	Jul 29, 2018 - Entire home/apt for $130. We are about to get a last minute cancellation for today, July 25th. If you want a quick getaway, contact me and I'll make sure you can come. With ...
/rooms/1012597	https://a0.muscache.com/im/pictures/17625628/ee60bf9c_original.jpg?aki_polity=xx_large	the house on the lake - Cottages for Rent in Anfo, Lombardy, Italy	Jul 29, 2018 - Private room for $61. Room with private bathroom in an old country house, located on a sunny slope overlooking the Idro lake (on the border between Lombardia and Trentin...
/rooms/326033	https://a0.muscache.com/im/pictures/8c9e5558-7a07-45af-afae-1ff6aae6c5e0.jpg?aki_polity=xx_large	Tropical Island Jungle Retreat - sleeps groups 16+ - Huts for Rent in Cristóbal Island, Bocas del Toro, Panama	Jul 29, 2018 - Entire home/apt for $100. We are located where 145acres of Jungle meet a turquoise Lagoon.On the southern tip of remote Isla Cristobal, an island without roads, you are sure...
/rooms/3964658	https://a0.muscache.com/im/pictures/56426415/c963bf4c_original.jpg?aki_polity=xx_large	Garden Suite Efficiency - Apartments for Rent in Washington, District of Columbia, United States	Jul 29, 2018 - Entire home/apt for $115. Private, independent garden suite with its own separate entrance through a lushly planted and sunny courtyard garden.   Restored detail and charact...
/rooms/5174212	https://a0.muscache.com/im/pictures/eb000e48-bac8-4020-bfed-595f932fafe2.jpg?aki_polity=xx_large	East Nashville Cozy & Cute Cottage! - Guesthouses for Rent in Nashville, Tennessee, United States	Jul 29, 2018 - Entire home/apt for $90. A cozy & clean renovated cottage in South Inglewood with private entrance. One bedroom, one bathroom cottage w/ a nice patio and backyard. Plenty o...
/rooms/107051	https://a0.muscache.com/im/pictures/1206429/f0af065f_original.jpg?aki_polity=xx_large	JESSIE the narrowboat in Little Venice - Boats for Rent in Central London Narrowboat, England, United Kingdom	Jul 29, 2018 - Entire home/apt for $197. JESSIE the narrowboat is moored in the heart of Little Venice on the north bank of the Pool of Little Venice and just opposite Brownings Island. It...
/rooms/1233784	https://a0.muscache.com/im/pictures/19755676/c2d3162d_original.jpg?aki_polity=xx_large	PORTA33 PENTHOUSE DOWNTOWN SPOT - Apartments for Rent in Porto, Porto District, Portugal	Jul 29, 2018 - Entire home/apt for $93. *If the dates you wish are not available, we have other options in the same location. You can find them below on the right side of this page.  Po...
/rooms/53243	https://a0.muscache.com/im/pictures/1768655/4d73993d_original.jpg?aki_polity=xx_large	Trullo aromatic green - Dome houses for Rent in Ostuni, Apúlia, Italy	Jul 29, 2018 - Entire home/apt for $105. An ancient trullo  surrounded by  panoramic contryside , away from the noise. Just relax, time taken lying on the hammock or a dip in our cristalli...
/rooms/260524	https://a0.muscache.com/im/pictures/4375723/0074b31f_original.jpg?aki_polity=xx_large	Leccio Apartment - Cimbolello - Apartments for Rent in Città della Pieve, Umbria, Italy	Jul 29, 2018 - Entire home/apt for $70. Our farmhouse is glad to give you hospitality in the Leccio apartment, it is indipendent and there's space for a couple and a third person.  You wi...
/rooms/543273	https://a0.muscache.com/im/pictures/7118022/5c105a4e_original.jpg?aki_polity=xx_large	original old Afghani yurt  -cool - Yurts for Rent in Nuremberg, Bavaria, Germany	Jul 29, 2018 - Entire home/apt for $45. Original Afghani yurt for those who want to spend a night differently. All details have been collected on our journeys around the world. Decorated ...
/rooms/3137482	https://a0.muscache.com/im/pictures/45073239/87418a31_original.jpg?aki_polity=xx_large	Chiado Loft 7 with Patio! - Apartments for Rent in Lisbon, Lisbon, Portugal	Jul 29, 2018 - Entire home/apt for $98. This duplex apartment with a patio is on the 4th and last floor of a building in Chiado. It was just entirely renovated. A very comfortable lounge ...
/rooms/3203468	https://a0.muscache.com/im/pictures/90908825/e96789d9_original.jpg?aki_polity=xx_large	Mongolian nomadic family - Yurts for Rent in Ulaanbaatar, Ulaanbaatar, Mongolia	Jul 29, 2018 - Private room for $49. Our Mongolian national ger house situated very near from the city. From the final bus station you have to go by car 20 minutes and reach to Mongoli...
/rooms/10201545	https://a0.muscache.com/im/pictures/09fbbef3-7872-4747-a1b9-257eb07ad1d9.jpg?aki_polity=xx_large	Sunny apartment near metro station. - Apartments for Rent in Vienna, Wien, Austria	Jul 29, 2018 - Entire home/apt for $64. I rent out a very sunny and bright apartment only 7 minutes walking distance to the metro station Ober-St. Veit. The aparrment has a spacious livin...
/rooms/20724950	https://a0.muscache.com/im/pictures/3d6df6f7-8ec3-43ef-8c58-e2ae567bc9cf.jpg?aki_polity=xx_large	Trailside Treehouse in RVA ~ Glamp w prvt bath! - Treehouses for Rent in Richmond, Virginia, United States	Jul 29, 2018 - Entire home/apt for $179. Fulfill that childhood dream of camping out in a treehouse! From this central haven, explore Richmond's trails/river to your heart's content. Then,...
/rooms/489668	https://a0.muscache.com/im/pictures/10356334/a831e142_original.jpg?aki_polity=xx_large	A quiet yurt  in Savoie - Bauges - Yurts for Rent in Bellecombe-en-Bauges, Rhone-Alpes, France	Jul 29, 2018 - Entire home/apt for $82. Peaceful life in nature  A Big yurt of 50 m2 in the massif of Wallows in Savoy. Calm down in the middle of nowhere. The view (sight) is 360 ° on ba...
/rooms/2168594	https://a0.muscache.com/im/pictures/61626696/e9e5d6da_original.jpg?aki_polity=xx_large	White Breeze Pool 1BD Apartment - Apartments for Rent in Phuket, Thailand, Rawai, Phuket, Thailand	Jul 29, 2018 - Entire home/apt for $56. FREE: Fiber Optic Internet Connection!  1 bedroom apartment with a king size bed, bathroom, a kitchen and dining/living area with a pull out sofa. ...
/rooms/1873760	https://a0.muscache.com/im/pictures/42045002/234f96d1_original.jpg?aki_polity=xx_large	SANGLUNG VILLA, PRIVATE POOL. - Houses for Rent in Singaraja, Bali, Indonesia	Jul 29, 2018 - Entire home/apt for $127. New luxury villa in North Bali near Singaraja. Sanglung villa  Completed in April  2014, the villa, sits in an elevated postion in one of the last ...
/rooms/6153074	https://a0.muscache.com/im/pictures/ba3f7bc4-31b8-435f-b5f9-5bc320901fe3.jpg?aki_polity=xx_large	PalacetedelVedado - Houses for Rent in Vedado, La Habana, Cuba	Jul 29, 2018 - Entire home/apt for $404. Welcome to our house, Enjoy an authentic small palace in Vedado, bright, fresh and spacious place. Best neighborhood in Havana, 5 min to Old Havana...
/rooms/2320681	https://a0.muscache.com/im/pictures/9a2e7666-dbb7-4516-8f54-e54432cbf8b9.jpg?aki_polity=xx_large	#thebarnTAS - Barns for Rent in Hobart, Tasmania, Australia	Jul 29, 2018 - Entire home/apt for $185. #thebarnTAS is our multi award winning barn conversion. It is located in Hobart's CBD just mere minutes from the city's major cultural and gastrono...
/rooms/557656	https://a0.muscache.com/im/pictures/d92f6e86-e033-4471-ad69-402302620d61.jpg?aki_polity=xx_large	Blue gate cave House - Earth houses for Rent in Pechina, Andalusia, Spain	Jul 29, 2018 - Entire home/apt for $36. This cave house is situated on a small hill , the main reason for hosting is to continue restoring it , my house already has a bit of all of you . ...
/rooms/317499	https://a0.muscache.com/im/pictures/3413475/09dbaeb6_original.jpg?aki_polity=xx_large	The Manor Master Chamber - Castles for Rent in Saint Paul, Minnesota, United States	Jul 29, 2018 - Private room for $75. The Master Bedroom is spacious and yet cozy.  It has tall ceilings and lots of windows that let in copious amounts of sunlight.  It is directly att...
/rooms/5525185	https://a0.muscache.com/im/pictures/95426b46-2354-43c8-84f4-b7de3923536a.jpg?aki_polity=xx_large	Welcome, your private 5star B&B & Cooking Lessons. - Villas for Rent in Buleleng, Bali, Indonesia	Jul 29, 2018 - Entire home/apt for $62. Over 135 FIVE STAR reviews say it all.  Welcome, Kubu Kusuma Guest House is a private paradise with no other guests, in the natural unspoilt beauty...
/rooms/348991	https://a0.muscache.com/im/pictures/4230043/7e9a64d3_original.jpg?aki_polity=xx_large	Korean Traditional Hanok - Houses for Rent in Seoul, South Korea	Jul 29, 2018 - Entire home/apt for $182. Korean traditional house in Hanok conservation area in Seoul. This hanok had been built in 1934 and fully renovated in 2012.  You can rent entire m...
/rooms/444289	https://a0.muscache.com/im/pictures/6061582/a643208f_original.jpg?aki_polity=xx_large	A beautiful villa in North Iceland  - Houses for Rent in Akureyri, Northeast, Iceland	Jul 29, 2018 - Entire home/apt for $297. A new spacious villa, one floor. All commodities, jacuzzi and beautiful scenery. Ideal for families or friends. The villa is located in the exclusi...
/rooms/3164732	https://a0.muscache.com/im/pictures/d0a75675-8e22-414e-aa24-296d11c3a5b1.jpg?aki_polity=xx_large	Sacred Geome-Tree House - Treehouses for Rent in Montezuma, Puntarenas, Costa Rica	Jul 29, 2018 - Entire home/apt for $79. Super magical & unique tree house based on sacred geometry located on an active organic farm.  It's truly in the trees, not on stilts.  It's compos...
/rooms/2691045	https://a0.muscache.com/im/pictures/f3ce6772-a3c9-4668-9234-2bb249f68584.jpg?aki_polity=xx_large	Design loft @Navigli - Porta Ticinese - Bocconi - Lofts for Rent in Milan, Lombardy, Italy	Jul 29, 2018 - Entire home/apt for $82. Loft with a ton of personality and environmentally conscious! Located in a peaceful courtyard, still very central, just steps away from the vibrant...
/rooms/2739720	https://a0.muscache.com/im/pictures/35706017/6fba6384_original.jpg?aki_polity=xx_large	"La Paige" Cute Apt Great location! - Serviced apartments for Rent in Montreal, Quebec, Canada	Jul 29, 2018 - Entire home/apt for $59. BEST LOCATION!! You are steps from Place des arts and the Quartier des Spectacles! You are practically in the midst of every festival montreal has ...
/rooms/534650	https://a0.muscache.com/im/pictures/6480365/4d89fd9c_original.jpg?aki_polity=xx_large	Small house in Paris Center - Houses for Rent in Paris-2E-Arrondissement, Île-de-France, France	Jul 29, 2018 - Entire home/apt for $93. Small house in a courtyard.   In Paris center of Paris, 1 minute walk of the subway Réaumur-Sébastopol (line 3 and line 4), at 2 minutes of the sub...
/rooms/8428282	https://a0.muscache.com/im/pictures/1cb50f94-b989-4665-bbc3-8cea158ea7ef.jpg?aki_polity=xx_large	Hip Overlook close-in to everything - Bungalows for Rent in Portland, Oregon, United States	Jul 29, 2018 - Private room for $69. (In case your dates aren't available try: https://www.airbnb.com/rooms/9958918)  Overlook is close to everything.  Just a block to parks and the Ma...
/rooms/3879545	https://a0.muscache.com/im/pictures/79126358/c1d30a34_original.jpg?aki_polity=xx_large	Hütte, Berghütte, Skihütte - Huts for Rent in Dornbirn, Vorarlberg, Austria	Jul 29, 2018 - Entire home/apt for $163.  Rent old, small, simple, cozy self-catering cottage with creaking ground and squeaky doors at approx. 1,000 meters above sea level at Bödele (Boed...
/rooms/6406028	https://a0.muscache.com/im/pictures/106438707/cd39951f_original.jpg?aki_polity=xx_large	Stylish Downtown Cozy Room - Townhouses for Rent in Toronto, Ontario, Canada	Jul 29, 2018 - Private room for $42. This is a lovely private room with one bed.  This a beautifully renovated 1890's Victorian townhome that is located in one of the major up and comi...
/rooms/11141498	https://a0.muscache.com/im/pictures/5f7953f6-1007-490c-8aef-e3af23e9b607.jpg?aki_polity=xx_large	Eco-friendly Treehouse: The Roost! - Treehouses for Rent in Greensboro, North Carolina, United States	Jul 29, 2018 - Entire home/apt for $90. Unique Treehouse apartment in center of the city. This new construction space in my backyard was built as a toxic-free, super energy efficient, nat...
/rooms/5116533	https://a0.muscache.com/im/pictures/717fef15-755d-4d52-b9c4-ed12e2300db5.jpg?aki_polity=xx_large	#2 SHANGHIGH HOME - Apartments for Rent in Shanghai, Shanghai Shi, China	Jul 29, 2018 - Entire home/apt for $66. Enjoy your Shanghai trip in a SHANGHIGH design home! Studio type room, ensuite bathroom, kitchen, plus the bed on the second floor of the duplex. D...
/rooms/948077	https://a0.muscache.com/im/pictures/d6afec30-a798-46cf-8a4e-8b3a1a52c8e7.jpg?aki_polity=xx_large	Capitol Hill Stylish Garden Cottage - Houses for Rent in Seattle, Washington, United States	Jul 29, 2018 - Entire home/apt for $99. Small Space, Big Style, Spectacular Location with a Free Parking Space Tucked into a lush courtyard, this cottage in Seattle’s renowned Harvard-Bel...
/rooms/7109513	https://a0.muscache.com/im/pictures/684b691a-b364-4eba-99eb-83c6427b1ece.jpg?aki_polity=xx_large	Zion Backcountry Yurt - Yurts for Rent in Orderville, Utah, United States	Jul 29, 2018 - Entire home/apt for $210. We are the perfect location for hiking the world famous Narrows hike or any other adventure near Zion National Park. We are a 45 minute drive from ...
/rooms/2075509	https://a0.muscache.com/im/pictures/45604883/54451b1c_original.jpg?aki_polity=xx_large	Stunning home in central Tokyo - Houses for Rent in Minato, Tokyo, Japan	Jul 29, 2018 - Entire home/apt for $721. Help to make your stay in Tokyo unforgettable at surely one of the best homes available on Airbnb in the city. 5 stories of stunning light-filled m...
/rooms/1167221	https://a0.muscache.com/im/pictures/4f15f0f0-88cd-4528-a3b0-26ef4ab3776e.jpg?aki_polity=xx_large	Boston walk to TRAIN 3 room master suite for 3 - Houses for Rent in Boston, Massachusetts, United States	Jul 29, 2018 - Private room for $90. This is a terrific master suite [The Lion] with a separate room within the room for a third person with a twin bed. A comfortable queen sized bed i...
/rooms/620701	https://a0.muscache.com/im/pictures/bf3a6456-a9cd-4247-a0ab-283d1d085ae1.jpg?aki_polity=xx_large	Little Island B&B [ free parking ] - Bed and breakfasts for Rent in Florence, Tuscany, Italy	Jul 29, 2018 - Private room for $59. ######################## Little Island Bed and Breakfast ########################  We are renovating the room  Version 2.0 will be available starti...
/rooms/1169704	https://a0.muscache.com/im/pictures/17588525/94250ea3_original.jpg?aki_polity=xx_large	BEST OF AVIGNON design quiet AC wifi citycenter - Apartments for Rent in Avignon, Provence-Alpes-Côte d'Azur, France	Jul 29, 2018 - Entire home/apt for $69. More than 430 AMAZING REVIEWS! Ideally located in the heart of the city, beautiful apartment well decorated, 1 to 4 people. Quiet, cozy, fully equi...
/rooms/6333040	https://a0.muscache.com/im/pictures/82774624/64c5edef_original.jpg?aki_polity=xx_large	1880s Carriage House in Curtis Park - Guesthouses for Rent in Denver, Colorado, United States	Jul 29, 2018 - Entire home/apt for $133. This charming space once held horses in the 1880s.  Converted in 2007, this cozy space boasts all the amenities of home...full bath, laundry access...
/rooms/9108378	https://a0.muscache.com/im/pictures/d6be8f6a-4f51-4012-b194-859670cfd526.jpg?aki_polity=xx_large	Hidden Gem of Budapest City Centre - Apartments for Rent in Budapest, Budapest, Hungary	Jul 29, 2018 - Entire home/apt for $58. This newly available studio apartment, in the heart of the city centre, has been renovated to a high standard with a fabulous little stone balcony ...
/rooms/1602856	https://a0.muscache.com/im/pictures/31258904/c1458aba_original.jpg?aki_polity=xx_large	Igloo by the Sea #6- 1 bed + loft - Igloos for Rent in Trinity Beach, Queensland, Australia	Jul 29, 2018 - Entire home/apt for $78. A unique holiday experience in the tranquil seaside community of Trinity Beach. Only steps from beautiful beaches and pool at your front door.  One...
/rooms/7858468	https://a0.muscache.com/im/pictures/103241544/5b858882_original.jpg?aki_polity=xx_large	The Artist's Experience - Apartments for Rent in New York, New York, United States	Jul 29, 2018 - Private room for $99. Cozy, warm atmosphere, perfect for the traveler looking for a real NY experience.This reservation is for one person.If you want to book for 2 guest...
/rooms/936930	https://a0.muscache.com/im/pictures/47263481/8a112c0f_original.jpg?aki_polity=xx_large	Small Camping Pod (2 people) - Dome houses for Rent in Richmond, North Yorkshire, United Kingdom	Jul 29, 2018 - Private room for $58. Try one of our comfy camping pods in N Yorkshire.  The Small Pod is ideal for 2 people, but you can fit in a child & dog too. Bring everything you ...
/rooms/9700554	https://a0.muscache.com/im/pictures/bc5cb80c-1668-4e5a-b573-baabb854be7e.jpg?aki_polity=xx_large	Gastown/Railtown Loft in Vancouver - Lofts for Rent in Vancouver, British Columbia, Canada	Jul 29, 2018 - Entire home/apt for $115. A beautiful, bright, airy 2 level loft at the edge of Gastown, Railtown + Chinatown. Steps away from some of the best restaurants + shops in the ci...
/rooms/943864	https://a0.muscache.com/im/pictures/f5bd3f39-8162-46d1-a670-a39a832072e9.jpg?aki_polity=xx_large	Trullo del 1800 in Valle d'Itria - Houses for Rent in Cisternino, Brindisi, Apúlia, Italy	Jul 29, 2018 - Entire home/apt for $92.  In Cisternino, inside a characteristic haven immersed in the Valle d'Itria, this intimate complex of trulli dates back to the 1800's, renovated ac...
/rooms/13370153	https://a0.muscache.com/im/pictures/9e4397d4-92b1-43b0-a7ef-9193ef430764.jpg?aki_polity=xx_large	Cedar Treehouse with all Amenities - Treehouses for Rent in Port Perry, Ontario, Canada	Jul 29, 2018 - Entire home/apt for $252. You will feel like you're a thousand miles from Toronto. Your own private space with several ponds for swimming, gazebo, fire pits, running water, ...
/rooms/3119090	https://a0.muscache.com/im/pictures/aa1e0445-b721-47ff-8530-c392ec3eca2d.jpg?aki_polity=xx_large	The castle you want come back to (Ad 1) - Castles for Rent in Nibbiano, Piacenza, Italy	Jul 29, 2018 - Entire home/apt for $1119. Castello di Tassara is 75 km from Milan,nestled on the Piacenza hills on the outskirts of the small village of Tassara. Recently restored and elega...
/rooms/9008858	https://a0.muscache.com/im/pictures/82fecb0a-6b8f-4467-81f0-b98779d1c7e8.jpg?aki_polity=xx_large	★CityCentre Penthouse.PrivateTerrace.25minAirport★ - Lofts for Rent in Copenhagen, Denmark	Jul 29, 2018 - Entire home/apt for $218. This unique Scandinavian penthouse apartment is located in the City centre of Copenhagen with fast and easy access from the Airport. With only 15 m...
/rooms/1234202	https://a0.muscache.com/im/pictures/22903552/b41736ff_original.jpg?aki_polity=xx_large	CHARMING HOUSE Seaside& Pine Forest - Villas for Rent in Labenne, Aquitaine, France	Jul 29, 2018 - Entire home/apt for $182. The Villa Amani is located in Labenne, surrounded by the pine trees, on the edge of the Aquitany Landes forest, between Hossegor / Capbreton and ...
